{
  "$schema": "http://json-schema.org/draft-07/schema#",
  "$id": "Credential-Format.json",
  "type": "object",
  "additionalProperties": false,
  "properties": {
    "$schema": {
      "$ref": "defs.json#/definitions/Schema"
    },
    "Name": {
      "type": "string",
      "description": "Unique identifier of the credential format"
    },
    "Implementation Support": {
      "$ref": "defs.json#/definitions/Implementation-Support"
    },
    "IPR Policy": {
      "$ref": "defs.json#/definitions/IPR-Policy"
    },
    "Specification": {
      "$ref": "defs.json#/definitions/Specification"
    },
    "Standardization (Body, Process)": {
      "$ref": "defs.json#/definitions/Standardization"
    },
    "Encoding Scheme": {
      "type": "string",
      "description": "Data encoding on the storage layer which applies to this credential format",
      "$comment": "can this be set as an enum since the amount of encoding schemes is limited?"
    },
    "Rich Schemas-Semantic": {
      "allOf": [
        {
          "$ref": "defs.json#/definitions/Filter"
        },
        {
          "description": "Is the credential format able to communicate data or annotations that supports the semantic understanding of the credential data?",
          "$comment": "this sounds like an objective field since semantic is a defined word"
        }
      ]
    },
    "Crypto Agility": {
      "allOf": [
        {
          "$ref": "defs.json#/definitions/Filter"
        },
        {
          "description": "Is the credential format capable to cover different cryptographic algorithms without any requirements and achieve cryptographic agility, as demanded by regulations?"
        }
      ]
    },
    "Selective Disclosure": {
      "allOf": [
        {
          "$ref": "defs.json#/definitions/Filter"
        },
        {
          "description": "Is the credential format capable of selective disclosure - presenting or revealing a subset of claims/attributes - without relying on architecture and protocol solutions like Just-in-Time issuance or a presentation transformation by a trusted third party?",
          "$comment": "Do we need to ask if kind of selective disclosure reveals more information like it should? Like using SD-JWT, the verifier can see that the value came from the same credential like in the past, but this is not the case for Anoncreds"
        }
      ]
    },
    "Predicates": {
      "allOf": [
        {
          "$ref": "defs.json#/definitions/Filter"
        },
        {
          "description": "Is the credential Format able to produce general-purpose predicates, that means attestations without revealing the data, e.g. a proof to be over 18 without revealing the date of birth?"
        }
      ]
    },
    "Compatibility with Signing Algorithms": {
      "type": "string",
      "description": "What signing algorithms can the format be combined with?",
      "$comment": "TBD: https://github.com/openwallet-foundation/credential-format-comparison-sig/issues/44"
    },
    "Compatibility with Key Management Methods (Issuer)": {
      "type": "array",
      "items": {
        "type": "string"
      },
      "description": "What key management methods can the credential format be combined with?",
      "$comment": "TBD: https://github.com/openwallet-foundation/credential-format-comparison-sig/issues/43"
    }
  },
  "required": ["$schema", "Name"],
  "title": "CredentialFormat"
}
