{
  "$schema": "../../schemas/Credential-Format.json",
  "Name": "ACDC",
  "Specification": "https://trustoverip.github.io/tswg-acdc-specification/",
  "Standardization (Body, Process)": "",
  "Encoding Scheme": "CESR",
  "Rich Schemas-Semantic": false,
  "Crypto Agility": true,
  "Selective Disclosure": true,
  "Predicates": false
}
